{
  "code_commit": "163bf39f5e9d92a10402e7e7316b124b9fb3924c",
  "conditions": [
    {
      "bytes_per_frame": {
        "gray_f64": 614400,
        "intensity_u8": 76800,
        "raw_rgb": 230400
      },
      "condition_id": "L8-320x240",
      "dtype": "uint8",
      "end_to_end_ns": {
        "max": 3154650.0,
        "mean": 2422463.111111111,
        "min": 2219846.0,
        "n": 18,
        "p50": 2287052.0,
        "p95": 3154650.0,
        "p99": 3154650.0,
        "std": 266362.1404262101
      },
      "gray_ns": {
        "max": 2964045.0,
        "mean": 2241288.3333333335,
        "min": 2035555.0,
        "n": 18,
        "p50": 2133226.0,
        "p95": 2964045.0,
        "p99": 2964045.0,
        "std": 241865.82467788027
      },
      "height": 240,
      "levels": 8,
      "luma_standard": "bt601",
      "peak_alloc_bytes": 3381080,
      "quantize_ns": {
        "max": 286666.0,
        "mean": 181174.77777777778,
        "min": 141463.0,
        "n": 18,
        "p50": 169283.0,
        "p95": 286666.0,
        "p99": 286666.0,
        "std": 39813.43231952915
      },
      "scene": "gradient",
      "width": 320
    },
    {
      "bytes_per_frame": {
        "gray_f64": 614400,
        "intensity_u8": 76800,
        "raw_rgb": 230400
      },
      "condition_id": "L16-320x240",
      "dtype": "uint8",
      "end_to_end_ns": {
        "max": 2625307.0,
        "mean": 2372062.722222222,
        "min": 2216362.0,
        "n": 18,
        "p50": 2380543.0,
        "p95": 2625307.0,
        "p99": 2625307.0,
        "std": 107545.38747059595
      },
      "gray_ns": {
        "max": 2382389.0,
        "mean": 2195341.111111111,
        "min": 2073193.0,
        "n": 18,
        "p50": 2192441.0,
        "p95": 2382389.0,
        "p99": 2382389.0,
        "std": 86772.39218264507
      },
      "height": 240,
      "levels": 16,
      "luma_standard": "bt601",
      "peak_alloc_bytes": 3381080,
      "quantize_ns": {
        "max": 242918.0,
        "mean": 176721.61111111112,
        "min": 142602.0,
        "n": 18,
        "p50": 159764.0,
        "p95": 242918.0,
        "p99": 242918.0,
        "std": 32230.301251977307
      },
      "scene": "gradient",
      "width": 320
    },
    {
      "bytes_per_frame": {
        "gray_f64": 614400,
        "intensity_u8": 76800,
        "raw_rgb": 230400
      },
      "condition_id": "L32-320x240",
      "dtype": "uint8",
      "end_to_end_ns": {
        "max": 2369030.0,
        "mean": 2253441.0555555555,
        "min": 2175511.0,
        "n": 18,
        "p50": 2238689.0,
        "p95": 2369030.0,
        "p99": 2369030.0,
        "std": 50070.876844143226
      },
      "gray_ns": {
        "max": 2170219.0,
        "mean": 2087093.7777777778,
        "min": 2029928.0,
        "n": 18,
        "p50": 2079349.0,
        "p95": 2170219.0,
        "p99": 2170219.0,
        "std": 35993.66891174606
      },
      "height": 240,
      "levels": 32,
      "luma_standard": "bt601",
      "peak_alloc_bytes": 3381080,
      "quantize_ns": {
        "max": 206305.0,
        "mean": 166347.27777777778,
        "min": 143267.0,
        "n": 18,
        "p50": 157767.0,
        "p95": 206305.0,
        "p99": 206305.0,
        "std": 21350.984252112372
      },
      "scene": "gradient",
      "width": 320
    },
    {
      "bytes_per_frame": {
        "gray_f64": 614400,
        "intensity_u8": 76800,
        "raw_rgb": 230400
      },
      "condition_id": "L64-320x240",
      "dtype": "uint8",
      "end_to_end_ns": {
        "max": 2460583.0,
        "mean": 2247643.277777778,
        "min": 2151045.0,
        "n": 18,
        "p50": 2212693.0,
        "p95": 2460583.0,
        "p99": 2460583.0,
        "std": 86800.14381440055
      },
      "gray_ns": {
        "max": 2317410.0,
        "mean": 2085188.4444444445,
        "min": 1992078.0,
        "n": 18,
        "p50": 2053035.0,
        "p95": 2317410.0,
        "p99": 2317410.0,
        "std": 86181.38292656833
      },
      "height": 240,
      "levels": 64,
      "luma_standard": "bt601",
      "peak_alloc_bytes": 3381080,
      "quantize_ns": {
        "max": 239416.0,
        "mean": 162454.83333333334,
        "min": 128861.0,
        "n": 18,
        "p50": 146015.0,
        "p95": 239416.0,
        "p99": 239416.0,
        "std": 31463.89285841082
      },
      "scene": "gradient",
      "width": 320
    },
    {
      "bytes_per_frame": {
        "gray_f64": 614400,
        "intensity_u8": 76800,
        "raw_rgb": 230400
      },
      "condition_id": "L128-320x240",
      "dtype": "uint8",
      "end_to_end_ns": {
        "max": 2654986.0,
        "mean": 2346202.277777778,
        "min": 2150643.0,
        "n": 18,
        "p50": 2325804.0,
        "p95": 2654986.0,
        "p99": 2654986.0,
        "std": 146597.97359741124
      },
      "gray_ns": {
        "max": 2447970.0,
        "mean": 2174968.4444444445,
        "min": 1993273.0,
        "n": 18,
        "p50": 2130554.0,
        "p95": 2447970.0,
        "p99": 2447970.0,
        "std": 140155.17018220364
      },
      "height": 240,
      "levels": 128,
      "luma_standard": "bt601",
      "peak_alloc_bytes": 3381080,
      "quantize_ns": {
        "max": 234886.0,
        "mean": 171233.83333333334,
        "min": 134063.0,
        "n": 18,
        "p50": 167603.0,
        "p95": 234886.0,
        "p99": 234886.0,
        "std": 26250.09107127059
      },
      "scene": "gradient",
      "width": 320
    },
    {
      "bytes_per_frame": {
        "gray_f64": 614400,
        "intensity_u8": 76800,
        "raw_rgb": 230400
      },
      "condition_id": "L256-320x240",
      "dtype": "uint8",
      "end_to_end_ns": {
        "max": 3293169.0,
        "mean": 2774398.722222222,
        "min": 2289621.0,
        "n": 18,
        "p50": 2691919.0,
        "p95": 3293169.0,
        "p99": 3293169.0,
        "std": 324246.70282257575
      },
      "gray_ns": {
        "max": 3035240.0,
        "mean": 2559564.111111111,
        "min": 2118694.0,
        "n": 18,
        "p50": 2508194.0,
        "p95": 3035240.0,
        "p99": 3035240.0,
        "std": 294303.1788396088
      },
      "height": 240,
      "levels": 256,
      "luma_standard": "bt601",
      "peak_alloc_bytes": 3381080,
      "quantize_ns": {
        "max": 276091.0,
        "mean": 214834.61111111112,
        "min": 147778.0,
        "n": 18,
        "p50": 219629.0,
        "p95": 276091.0,
        "p99": 276091.0,
        "std": 38702.8326211961
      },
      "scene": "gradient",
      "width": 320
    },
    {
      "bytes_per_frame": {
        "gray_f64": 2457600,
        "intensity_u8": 307200,
        "raw_rgb": 921600
      },
      "condition_id": "L8-640x480",
      "dtype": "uint8",
      "end_to_end_ns": {
        "max": 11781577.0,
        "mean": 10301250.055555556,
        "min": 9590926.0,
        "n": 18,
        "p50": 10010436.0,
        "p95": 11781577.0,
        "p99": 11781577.0,
        "std": 634588.4564663825
      },
      "gray_ns": {
        "max": 10938688.0,
        "mean": 9464487.444444444,
        "min": 8737559.0,
        "n": 18,
        "p50": 9184460.0,
        "p95": 10938688.0,
        "p99": 10938688.0,
        "std": 620195.0861892143
      },
      "height": 480,
      "levels": 8,
      "luma_standard": "bt601",
      "peak_alloc_bytes": 13518680,
      "quantize_ns": {
        "max": 941333.0,
        "mean": 836762.6111111111,
        "min": 724633.0,
        "n": 18,
        "p50": 825976.0,
        "p95": 941333.0,
        "p99": 941333.0,
        "std": 51525.77674991517
      },
      "scene": "gradient",
      "width": 640
    },
    {
      "bytes_per_frame": {
        "gray_f64": 2457600,
        "intensity_u8": 307200,
        "raw_rgb": 921600
      },
      "condition_id": "L16-640x480",
      "dtype": "uint8",
      "end_to_end_ns": {
        "max": 10825484.0,
        "mean": 9900415.277777778,
        "min": 8979483.0,
        "n": 18,
        "p50": 9846177.0,
        "p95": 10825484.0,
        "p99": 10825484.0,
        "std": 599479.2375196997
      },
      "gray_ns": {
        "max": 9958005.0,
        "mean": 9102994.0,
        "min": 8267918.0,
        "n": 18,
        "p50": 9007394.0,
        "p95": 9958005.0,
        "p99": 9958005.0,
        "std": 566122.6237503673
      },
      "height": 480,
      "levels": 16,
      "luma_standard": "bt601",
      "peak_alloc_bytes": 13518680,
      "quantize_ns": {
        "max": 913003.0,
        "mean": 797421.2777777778,
        "min": 631931.0,
        "n": 18,
        "p50": 793917.0,
        "p95": 913003.0,
        "p99": 913003.0,
        "std": 83147.19678832337
      },
      "scene": "gradient",
      "width": 640
    },
    {
      "bytes_per_frame": {
        "gray_f64": 2457600,
        "intensity_u8": 307200,
        "raw_rgb": 921600
      },
      "condition_id": "L32-640x480",
      "dtype": "uint8",
      "end_to_end_ns": {
        "max": 12726967.0,
        "mean": 10174517.5,
        "min": 8889169.0,
        "n": 18,
        "p50": 9881623.0,
        "p95": 12726967.0,
        "p99": 12726967.0,
        "std": 997440.3557648753
      },
      "gray_ns": {
        "max": 11909374.0,
        "mean": 9323568.222222222,
        "min": 8235075.0,
        "n": 18,
        "p50": 9052468.0,
        "p95": 11909374.0,
        "p99": 11909374.0,
        "std": 929017.8344495244
      },
      "height": 480,
      "levels": 32,
      "luma_standard": "bt601",
      "peak_alloc_bytes": 13518680,
      "quantize_ns": {
        "max": 1480715.0,
        "mean": 850949.2777777778,
        "min": 639976.0,
        "n": 18,
        "p50": 810216.0,
        "p95": 1480715.0,
        "p99": 1480715.0,
        "std": 192353.53867489978
      },
      "scene": "gradient",
      "width": 640
    },
    {
      "bytes_per_frame": {
        "gray_f64": 2457600,
        "intensity_u8": 307200,
        "raw_rgb": 921600
      },